ISRCTN80472712,Testing IMM60 in combination with pembrolizumab in melanoma and non-small cell lung cancer,"CPMS 46501, IRAS 286317","Approved 25/11/2020, RES Committee South Central – Oxford B (Barlow House, 3rd Floor, 4 Minshull Street, Manchester, M1 3DZ, UK; +44 (0)207 104 8235; oxfordb.rec@hra.nhs.uk), ref: 20/SC/0367",United Kingdom; England,,Planned publication in a high-impact peer-reviewed journal.,Data sharing statement to be made available at a later date,,,NIHR Oxford Biomedical Research Centre; iOx Therapeutics,University of Oxford,United Kingdom,England,https://ror.org/052gg0110,http://dx.doi.org/10.13039/501100013373,31/12/2024,01/02/2020,31/12/2023,01/06/2021,31/10/2023,16/06/2023,22/01/2021,Ongoing,Recruiting,Prospectively registered,2020-001351-41,286317,Nil known,Interventional randomized controlled trial,Interventional,"Malignant neoplasms of respiratory and intrathoracic organs, Melanoma and other malignant neoplasms of skin",Cancer,,private sector organisation,University/education,Randomised controlled trial,Hospital,Treatment,Drug,,"IMM60, pembrolizumab",Phase I,Patient,Adult,18 Years,,Both,12,,,,,,,,,,,,,,,,,,,,,,,,,,,
ISRCTN95900287,A trial to see the effect of cyclophosphamide and pembrolizumab on cancer in the kidney that has spread further into the body,"CPMS 42424, IRAS 257309","Approved 24/12/2019, North West - Haydock Research Ethics Committee (3rd Floor - Barlow House, 4 Minshull Street, Manchester, M1 3DZ, UK; Tel: +44 (0)207 104 8012; Email: nrescommittee.northwest-haydock@nhs.net), ref: 19/NW/0705",United Kingdom; England; Scotland,,1. Peer-reviewed scientific journals 2. Internal report 3. Conference presentation 4. Publication on website 5. Submission to regulatory authorities,Data sharing statement to be made available at a later date,,,Merck Sharp and Dohme,Christie Hospital NHS Foundation Trust,United Kingdom,England,https://ror.org/03v9efr22,http://dx.doi.org/10.13039/100009947,01/01/2024,20/02/2018,28/04/2024,28/04/2021,28/04/2023,05/08/2022,07/02/2020,Ongoing,No longer recruiting,Prospectively registered,2018-004314-17,257309,Nil known,"Non-randomised; Interventional; Design type: Treatment, Drug, Immunotherapy",Interventional,Metastatic renal cell carcinoma,Cancer,,private sector organisation,Hospital/treatment centre,Non randomised study,Hospital,Treatment,Drug,,"Cyclophosphamide, pembrolizumab",Phase I,Patient,Adult,18 Years,,Both,21,,,,,,,,https://www.hra.nhs.uk/planning-and-improving-research/application-summaries/research-summaries/caper/,,,,,,,,,,,,ISRCTN95900287_PROTOCOL_v3.0_11Dec2019.pdf (https://www.isrctn.com/editorial/retrieveFile/c6ad0290-fa0d-4f19-bc57-435aef7fcf43/37746),,,,,,,
ISRCTN39816629,Mesothelioma Stratified Therapy (MiST): A multi-drug phase II trial in malignant mesothelioma,627,"East Midlands - Leicester South Research Ethics Committee, 05/07/2018, 18/EM/0118",United Kingdom; England,,The results of the trial will be published in a high-impact peer reviewed scientific journal around six months after each individual trial treatment protocol has completed.,Available on request,,2021 Results article in https://pubmed.ncbi.nlm.nih.gov/33515503/ MiST1 (added 28/06/2022) 2022 Results article in https://pubmed.ncbi.nlm.nih.gov/35157829/ MiST2 (added 28/06/2022),British Lung Foundation,University of Leicester,United Kingdom,England,https://ror.org/04h699437,http://dx.doi.org/10.13039/501100000351,01/06/2020,01/04/2017,01/10/2023,01/01/2019,31/01/2023,30/08/2022,01/10/2018,Ongoing,No longer recruiting,Prospectively registered,2017-003353-41,,NCT03654833,Interventional non-randomised study,Interventional,Mesothelioma,Cancer,,private sector organisation,University/education,Non randomised study,Hospital,Treatment,Drug,,"Rucaparib, abemaciclib, pembrolizumab, bemcentinib, atezolizumab, bevacizumab, dostarlimab, niraparib",Phase II,Patient,Adult,18 Years,,Both,200,,01/06/2021,,,,,,https://www.hra.nhs.uk/planning-and-improving-research/application-summaries/research-summaries/mesothelioma-stratified-therapy-mist/,,,,,,,,,,,,,,,MiST1 (https://pubmed.ncbi.nlm.nih.gov/33515503/); MiST2 (https://pubmed.ncbi.nlm.nih.gov/35157829/),,,,
ISRCTN15837212,DANTE: Duration of Anti-PD1 therapy for melanoma,35180,"East Midlands – Leicester South Research Ethics Committee, 18/01/2018, ref: 17/EM/0440",United Kingdom; England; Northern Ireland; Scotland; Wales,,The study protocol will be published. Planned publication of the study results in a high-impact peer reviewed journal. Primary analysis publication anticipated February 2025. Long-term results publication anticipated February 2028.,Data sharing statement to be made available at a later date,,2021 Protocol article in https://pubmed.ncbi.nlm.nih.gov/34210290/ (added 05/07/2021),National Institute for Health Research,Sheffield Teaching Hospitals NHS Foundation Trust,United Kingdom,England,https://ror.org/018hjpz25,http://dx.doi.org/10.13039/501100000272,01/02/2025,01/02/2017,15/10/2024,13/08/2018,15/09/2023,14/10/2022,31/07/2018,Ongoing,Recruiting,Prospectively registered,2017-002435-42,,,"Randomised; Interventional; Design type: Treatment, Drug, Immunotherapy, Active Monitoring",Interventional,Metastatic melanoma,Cancer,,government organisation,Hospital/treatment centre,Randomised controlled trial,Hospital,Treatment,Other,,,Phase IV,Patient,Adult,18 Years,,Both,1208,,,,,,,,https://www.hra.nhs.uk/planning-and-improving-research/application-summaries/research-summaries/dante-duration-of-anti-pd1-therapy-for-melanoma/,,,,,,,,,,,https://pubmed.ncbi.nlm.nih.gov/34210290/,,,,,,,,
ISRCTN14634058,PARIS-Pembrolizumab in combination with radiotherapy in locally advanced non-small cell lung cancer (NSCLC),34452,"North West - Greater Manchester South Research Ethics Committee, 22/05/2017, rec: 17/NW/0242",England; United Kingdom,Stopped,Planned publication in a high-impact peer reviewed journal and presentation of results at a relevant conference around one year after the end of the study.,Data sharing statement to be made available at a later date,,,Cancer Research UK,The Christie NHS Foundation Trust,United Kingdom,England,https://ror.org/03v9efr22,http://dx.doi.org/10.13039/501100000289,01/02/2021,01/10/2016,31/12/2020,01/08/2017,01/02/2020,21/06/2019,19/07/2017,Stopped,Stopped,Prospectively registered,2017-000444-17,,,"Non-randomised; Interventional; Design type: Treatment, Drug, Radiotherapy",Interventional,Lung Cancer,Cancer,,private sector organisation,Hospital/treatment centre,Randomised controlled trial,Hospital,Treatment,Other,,,Phase I,Patient,Adult,18 Years,,Both,25,,,,,,,,https://www.hra.nhs.uk/planning-and-improving-research/application-summaries/research-summaries/paris-2/,,,,,,,,,,,,,,,,,,,
ISRCTN12569958,A trial using blood tests to detect cancer cells after standard treatment to trigger additional treatment in early stage triple negative breast cancer patients,33825,"South Central - Oxford C Research Ethics Committee, 05/04/2017, ref: 17/SC/0090",United Kingdom; England; Scotland; Wales,,"The main trial results will be published in a peer‐reviewed journal, on behalf of all collaborators. It is the aim that this will be published around 1 year after the overall trial end date.",Available on request,,2022 Results article in https://pubmed.ncbi.nlm.nih.gov/36423745/ (added 04/01/2023),Merck Sharp and Dohme; National Institute for Health Research,Institute of Cancer Research,United Kingdom,,https://ror.org/043jzw605,http://dx.doi.org/10.13039/100009947; http://dx.doi.org/10.13039/501100000272,31/12/2022,01/07/2015,31/12/2023,21/12/2018,06/12/2019,04/01/2023,19/06/2017,Ongoing,No longer recruiting,Prospectively registered,2017-000508-92,,NCT03145961,"Randomised; Both; Design type: Treatment, Screening, Immunotherapy, Active Monitoring, Cohort study",Interventional,Breast cancer,Cancer,,government organisation; private sector organisation,Research organisation,Randomised controlled trial,Hospital,Treatment,Other,,,,Patient,Adult,18 Years,,Both,200,208,21/11/2022,,,,,,https://www.hra.nhs.uk/planning-and-improving-research/application-summaries/research-summaries/c-trak-tn/,,,,,,,,,,,,ISRCTN12569958_PROTOCOL_V6.0_16Jun20.pdf (https://www.isrctn.com/editorial/retrieveFile/86442f20-4067-4bd9-af1a-55c83c0299fd/33612),,,https://pubmed.ncbi.nlm.nih.gov/36423745/,,,,
ISRCTN10047797,A phase II trial of pembrolizumab in NSCLC PS2 patients,31307,"West Midlands - Edgbaston Research Ethics Committee, 02/02/2016, ref: 16/WM/0010",United Kingdom; England; Wales,,Not provided at time of registration,Not expected to be made available,,2020 Results article in https://www.ncbi.nlm.nih.gov/pubmed/32199466 results (added 23/03/2020),Merck Sharp and Dohme,University of Birmingham,United Kingdom,England,https://ror.org/03angcq70,http://dx.doi.org/10.13039/100009947,01/09/2021,01/12/2015,01/01/2022,30/09/2016,13/02/2018,20/09/2021,11/08/2016,Completed,No longer recruiting,Prospectively registered,2015-002241-55,,NCT02733159,"Non-randomised; Interventional; Design type: Treatment, Screening, Diagnosis, Prevention, Drug, Imaging, Immunotherapy, Physical",Interventional,"Specialty: Cancer, Primary sub-specialty: Lung; UKCRC code/ Disease: Cancer/ Malignant neoplasms of respiratory and intrathoracic organs",Cancer,,private sector organisation,University/education,Non randomised study,Hospital,Treatment,Drug,,Pembrolizumab,Phase II,Patient,Adult,18 Years,,Both,60,62,23/03/2020,,,,,,https://www.hra.nhs.uk/planning-and-improving-research/application-summaries/research-summaries/a-phase-ii-trial-of-pembrolizumab-in-nsclc-ps2-patients/,,,,,,https://www.cancerresearchuk.org/about-cancer/find-a-clinical-trial/a-trial-looking-at-pembrolizumab-for-people-with-non-small-cell-lung-cancer-peps2,,,,,,,,,results (https://www.ncbi.nlm.nih.gov/pubmed/32199466),,,,
