"Rank","NCT Number","Title","Acronym","Status","Study Results","Conditions","Interventions","Outcome Measures","Sponsor/Collaborators","Gender","Age","Phases","Enrollment","Funded Bys","Study Type","Study Designs","Other IDs","Start Date","Primary Completion Date","Completion Date","First Posted","Results First Posted","Last Update Posted","Locations","Study Documents","URL"
294,"NCT00471237","A Phase II Study Evaluating SB-751689 in Post-Menopausal Women With Osteoporosis.",,"Terminated","Has Results","Osteoporosis","Drug: Ronacaleret|Drug: Teriparatide|Drug: Alendronate","Percent Change From Baseline in Bone Marrow Density (BMD) at Month 12 Measured by Dual-Energy X-Ray Absorptiometry (DXA) Scans of the Lumbar Spine (L1-L4)|Number of Participants With Hypercalcemia|Number of Participants Withdrew Due to Hypercalcemia|Number of Participant With Laboratory Abnormalities of Potential Clinical Concern at Any Post-baseline Visit|Number of Participant With Vital Signs of Potential Clinical Concern at Any Post-baseline Visit|Number of Participant With Electrocardiogram (ECG) Findings Reported as Adverse Event|Mean Change From Baseline in Height|Mean Change From Baseline in Weight|Percent Change From Baseline to Month 6 in BMD Measured by DXA Scans of the Lumbar Spine (L1-L4)|Percent Change From Baseline to Months 6 and 12 in BMD Measured by DXA Scans of the Hip (Total Hip, Femoral Neck and Trochanter).|Number of Participants Who Remained the Same or Had Any Improvement in DXA BMD (> Baseline)|Percent Change From Baseline to Month 12 in the Volumetric Integral, Cortical, and Trabecular Density (BMD) at the Hip and Lumbar Spine as Measured by Quantitative Computer Tomography (QCT) Scans|Percent Change From Baseline to Month 12 in the Total Vertebra Integral VOI at the Lumbar Spine as Measured by QCT Scans|Percent Change From Baseline to Month 12 in the Volumetric Integral, Cortical, and Trabecular Density (BMD) at the Hip as Measured by QCT Scans|Percent Change From Baseline to Month 12 in Cortical Thickness at the Hip as Measured by QCT Scans|Biochemical Markers of Bone Turnover: Levels of C-terminal Telopeptide α1 Chain of Type 1 Collagen (CTX1)|Biochemical Markers of Bone Turnover: Procollagen Type 1 N-terminal Propeptide (P1NP)|Biochemical Markers of Bone Turnover: Bone Specific Alkaline Phosphatase (BALP)|Blood Concentrations of Ronacaleret|Area Under the Concentration-time Curve Over the Dosing Interval (AUC 0-t) and Area Under the Concentration-time Curve Over the Dosing Interval (AUC 0-tau) of Ronacaleret|Maximum Blood Concentration (Cmax) of Ronacaleret|Time Required to Achieve Maximum Concentration of Ronacaleret in Blood (Tmax)","GlaxoSmithKline","Female","18 Years to 79 Years   (Adult, Older Adult)","Phase 2","564","Industry","Interventional","Allocation: Randomized|Intervention Model: Parallel Assignment|Masking: Triple (Participant, Investigator, Outcomes Assessor)|Primary Purpose: Treatment","CR9108963","May 14, 2007","December 26, 2008","December 26, 2008","May 9, 2007","September 5, 2017","November 7, 2017","GSK Investigational Site, Oakland, California, United States|GSK Investigational Site, Palm Desert, California, United States|GSK Investigational Site, Walnut Creek, California, United States|GSK Investigational Site, Decatur, Georgia, United States|GSK Investigational Site, Bethesda, Maryland, United States|GSK Investigational Site, Akron, Ohio, United States|GSK Investigational Site, Cleveland, Ohio, United States|GSK Investigational Site, Portland, Oregon, United States|GSK Investigational Site, Duncansville, Pennsylvania, United States|GSK Investigational Site, Ciudad Autónoma de Buenos Aires, Buenos Aires, Argentina|GSK Investigational Site, Ciudad Autonoma de Buenos Aires, Argentina|GSK Investigational Site, Ciudad Autónoma de Buenos Aires, Argentina|GSK Investigational Site, St Leonards, New South Wales, Australia|GSK Investigational Site, Footscray, Victoria, Australia|GSK Investigational Site, Geelong, Victoria, Australia|GSK Investigational Site, Heidelberg, Victoria, Australia|GSK Investigational Site, Gent, Belgium|GSK Investigational Site, Liege, Belgium|GSK Investigational Site, Tienen, Belgium|GSK Investigational Site, Ballerup, Denmark|GSK Investigational Site, Frankfurt, Hessen, Germany|GSK Investigational Site, Berlin, Germany|GSK Investigational Site, Berlin, Germany|GSK Investigational Site, Berlin, Germany|GSK Investigational Site, Berlin, Germany|GSK Investigational Site, Hamburg, Germany|GSK Investigational Site, Hamburg, Germany|GSK Investigational Site, Hong Kong, Hong Kong|GSK Investigational Site, Shatin, Hong Kong|GSK Investigational Site, Seoul, Korea, Republic of|GSK Investigational Site, Suwon, Korea, Republic of|GSK Investigational Site, Mexico, D.F., Mexico|GSK Investigational Site, Bergen, Norway|GSK Investigational Site, Hamar, Norway|GSK Investigational Site, Oslo, Norway|GSK Investigational Site, Grudziadz, Poland|GSK Investigational Site, Warszawa, Poland|GSK Investigational Site, Wroclaw, Poland|GSK Investigational Site, Moscow, Russian Federation|GSK Investigational Site, Moscow, Russian Federation|GSK Investigational Site, Panorama, South Africa|GSK Investigational Site, Rosebank, South Africa|GSK Investigational Site, Somerset West, South Africa|GSK Investigational Site, Barcelona, Spain|GSK Investigational Site, Barcelona, Spain|GSK Investigational Site, Madrid, Spain|GSK Investigational Site, Madrid, Spain|GSK Investigational Site, Santiago de Compostela, Spain|GSK Investigational Site, Santiago de Compostela, Spain",,"https://ClinicalTrials.gov/show/NCT00471237"
295,"NCT02154776","Dose Escalation Study of LEE011 in Combination With Buparlisib and Letrozole in HR+, HER2-negative Post-menopausal Women With Advanced Breast Cancer.","LeeBLet","Completed","No Results Available","Advanced or Metastatic Breast Cancer","Drug: LEE011|Drug: Buparlisib|Drug: Letrozole","Incidence of dose-limiting toxicities (DLTs)|Safety and tolerability of the combination of LEE011, buparlisib, and letrozole|Safety and tolerabiity of the combination of LEE011, buparlisib, and letrozole|Pharmacokinetic paramters such as AUClast and Cmax of LEE011, buparlisib, and letrozole in order to characterize the PK profiles|Disease control rate|PFS (progression free survival)","Novartis Pharmaceuticals|Novartis","Female","18 Years and older   (Adult, Older Adult)","Phase 1","13","Industry","Interventional","Allocation: N/A|Intervention Model: Single Group Assignment|Masking: None (Open Label)|Primary Purpose: Other","CLEE011A2112C","June 27, 2014","October 26, 2016","October 26, 2016","June 3, 2014",,"December 19, 2020","University of California at Los Angeles UCLA SC, Los Angeles, California, United States|Horizon Oncology Center SC, Lafayette, Indiana, United States|Medical University of South Carolina SC, Charleston, South Carolina, United States|South Texas Accelerated Research Therapeutics SC, San Antonio, Texas, United States|University of Utah / Huntsman Cancer Institute SC-3, Salt Lake City, Utah, United States|Novartis Investigative Site, Madrid, Spain",,"https://ClinicalTrials.gov/show/NCT02154776"
296,"NCT03006003","Osteoporosis Treatment in Post-menopausal Women",,"Unknown status","No Results Available","Depressive Syndrome","Drug: Raloxifene|Drug: Alendronate","Brain-derived neurotrophic factor|Vascular cell adhesion molecule-1|Orexin-A|Body components|Zung self-rating depression scale|5-Item Geriatric Depression Scale|The Mini Mental State Examination (MMSE)|The Barthel index|Instrumental Activities of Daily Living (IADL)|ankle-brachial index","Taichung Veterans General Hospital","Female","20 Years and older   (Adult, Older Adult)","Phase 4","500","Other","Interventional","Allocation: Non-Randomized|Intervention Model: Parallel Assignment|Masking: None (Open Label)|Primary Purpose: Treatment","CE16256A","January 1, 2017","December 2021","December 2021","December 30, 2016",,"January 14, 2019","outpatient clinic of the Division of Endocrinology and Metabolism in Taichung Veterans General Hospital, Taichung, Taiwan|Taichung Veterans General Hospital, Taichung, Taiwan",,"https://ClinicalTrials.gov/show/NCT03006003"
297,"NCT00489424","Acetaminophen or Fluvastatin Compared to Placebo on the Transient Post-Dose Symptoms (PDS) Following an Intravenous (i.v.) Infusion of a Single Dose of Zoledronic Acid 5mg, in Post-menopausal Women With Low Bone Mass",,"Completed","Has Results","Osteoporosis","Drug: Placebo|Drug: Acetaminophen|Drug: Fluvastatin","Proportion of Patients With a Clinically Significant Increase in Oral Body Temperature or Use of Rescue Medication.|Proportion of Patients With a Clinically Significant Increase in Oral Body Temperature.|Proportion of Patients Who Used Rescue Medication.|Number of Rescue Medication Tablets Taken|Time to First Rescue Medication After Infusion of Zoledronic Acid 5 mg.|Proportion of Patients With a Major Increase (Worsening) in Severity of Questionnaire Symptoms.|Proportion of Patients Reporting Severe Questionnaire Symptoms.|Change From Baseline in Visual Analog Scale (VAS) Measurement of Symptom Severity","Novartis Pharmaceuticals|Novartis","Female","45 Years to 79 Years   (Adult, Older Adult)","Phase 4","793","Industry","Interventional","Allocation: Randomized|Intervention Model: Parallel Assignment|Masking: Double (Participant, Investigator)|Primary Purpose: Treatment","CZOL446HUS136","June 2007","December 2007","December 2007","June 21, 2007","September 14, 2009","February 18, 2011","Refer to the E-portal link for ZOL446HUS136, Http://www.osteoporosisclinicalresearch.com, New Jersey, United States",,"https://ClinicalTrials.gov/show/NCT00489424"
298,"NCT02357745","Evaluation of Neopterin Levels in Pre and Post-menopausal Women With Periodontitis Following Non Surgical Therapy","ENLPPMNS","Unknown status","No Results Available","Periodontitis","Procedure: Non surgical periodontal therapy","Co-relating neopterin and periodontitis levels in pre and post menopausal women","Panineeya Mahavidyalaya Institute of Dental Sciences & Research Centre","Female","40 Years to 60 Years   (Adult)",,"30","Other","Observational","Time Perspective: Cross-Sectional","suma thesis","February 2015","May 2015","May 2015","February 6, 2015",,"February 6, 2015",,,"https://ClinicalTrials.gov/show/NCT02357745"
299,"NCT05002894","Effect of Pilates Exercises On Fatigue In Post Menopausal Women",,"Not yet recruiting","No Results Available","Fatigue","Other: Pilates exercises|Dietary Supplement: medical standard care for fatigue","change in Fatigue Assessment Scale|change in Intreluken-6 test","Cairo University","Female","50 Years to 55 Years   (Adult)","Not Applicable","52","Other","Interventional","Allocation: Randomized|Intervention Model: Parallel Assignment|Masking: Quadruple (Participant, Care Provider, Investigator, Outcomes Assessor)|Primary Purpose: Treatment","Pilates Effect On Fatigue","September 2021","January 2022","February 2022","August 12, 2021",,"August 12, 2021",,,"https://ClinicalTrials.gov/show/NCT05002894"
300,"NCT02666105","Exemestane in Post-Menopausal Women With NSCLC",,"Completed","No Results Available","Non-Small Cell Lung Cancer","Drug: Exemestane","Disease Response|Toxicity severity will be graded using the Common Toxicity Criteria for Adverse Events (CTCAE) version 4|Response Duration|Progression-free survival|Overall survival|Quality of Life","Masonic Cancer Center, University of Minnesota","Female","Child, Adult, Older Adult","Phase 2","6","Other","Interventional","Allocation: N/A|Intervention Model: Single Group Assignment|Masking: None (Open Label)|Primary Purpose: Treatment","2015LS095","September 27, 2018","February 28, 2022","February 28, 2022","January 28, 2016",,"April 12, 2022","Mayo Clinic Health System, Albert Lea, Minnesota, United States|Essentia Health St. Joseph's Medical Center, Brainerd, Minnesota, United States|Essentia Health Deer River, Deer River, Minnesota, United States|Essentia Health St. Mary's Detroit Lakes, Detroit Lakes, Minnesota, United States|Essentia Health Cancer Center, Duluth, Minnesota, United States|Essentia Health Fosston, Fosston, Minnesota, United States|Fairview Grand Itasca Clinic & Hospital, Grand Rapids, Minnesota, United States|Essentia Health Hibbing, Hibbing, Minnesota, United States|Fairview Range Medical Center, Hibbing, Minnesota, United States|Mayo Clinic Health System, Mankato, Minnesota, United States|Masonic Cancer Center, University of Minnesota, Minneapolis, Minnesota, United States|Monticello Cancer Center (MMCORC), Monticello, Minnesota, United States|Essentia Health Park Rapids, Park Rapids, Minnesota, United States|Fairview Northland Medical Center, Princeton, Minnesota, United States|Essentia Health Sandstone, Sandstone, Minnesota, United States|Sanford Thief River Falls Medical Center, Thief River Falls, Minnesota, United States|Essentia Health Virginia, Virginia, Minnesota, United States|Sanford Worthington Medical Center, Worthington, Minnesota, United States",,"https://ClinicalTrials.gov/show/NCT02666105"
301,"NCT02422069","Study of Post Menopausal Osteoporosis (PMO) Among Gynecology Outpatients in Pakistan",,"Completed","No Results Available","Postmenopausal Osteoporosis",,"Percentage of patients diagnosed with PMO based upon dual-energy X-ray absorptiometry (DXA) results|Use of various PMO treatment modalities","Hoffmann-La Roche","Female","50 Years and older   (Adult, Older Adult)",,"624","Industry","Observational","Observational Model: Cohort|Time Perspective: Cross-Sectional","ML25212","April 2010","December 2011","December 2011","April 21, 2015",,"November 2, 2016","Islamabad, Pakistan|Karachi, Pakistan|Karachi, Pakistan|Karachi, Pakistan|Lahore, Pakistan|Lahore, Pakistan|Lahore, Pakistan|Rawalpindi, Pakistan",,"https://ClinicalTrials.gov/show/NCT02422069"
302,"NCT01653275","Mediterranean Diet for Post-menopausal Women: Effects on Bone Turnover","MedSD","Completed","No Results Available","Osteoporosis|Postmenopausal Bone Loss","Other: Mediterranean Diet","study adherence|Bone turnover markers","UConn Health|University of Connecticut","Female","65 Years and older   (Older Adult)","Not Applicable","22","Other","Interventional","Allocation: N/A|Intervention Model: Single Group Assignment|Masking: None (Open Label)|Primary Purpose: Treatment","12-136S-1","April 2012","December 2014","December 2014","July 30, 2012",,"May 10, 2017","UCHC, Farmington, Connecticut, United States",,"https://ClinicalTrials.gov/show/NCT01653275"
303,"NCT00882141","Race, Menopause and Metabolism After Exercise and Diet",,"Completed","No Results Available","Obesity|Insulin Resistance|Sedentary Lifestyle","Behavioral: Diet modification|Behavioral: Aerobic exercise","Glucose Clamp|Fat biopsy","National Institute on Aging (NIA)","Female","45 Years to 80 Years   (Adult, Older Adult)","Not Applicable","103","NIH","Interventional","Allocation: Non-Randomized|Intervention Model: Parallel Assignment|Masking: None (Open Label)|Primary Purpose: Treatment","AG0116|R01AG019310|R01AG020116","March 2002","December 2008","December 2008","April 16, 2009",,"January 13, 2010","University of Maryland, VAMC, Baltimore, Maryland, United States",,"https://ClinicalTrials.gov/show/NCT00882141"
304,"NCT03304743","Dental Panoramic Radiographs to Screen for Post-menopausal Osteoporosis","OsteoPano","Completed","No Results Available","Osteoporosis, Postmenopausal","Diagnostic Test: Dental panoramic radiograph","sensitivity and specificity of Klemetti Index|sensitivity and specificity of mandibular cortical width|sensitivity and specificity of panoramic mandibular index|Precision and reproducibility of Klemetti index|Number of post-menopausal women attending a University Dental Hospital (Centro Universitario di Odontoiatria) and identified as osteoporotic with the help of the panoramic indices|number of osteoporotic women identified as osteoporotic with the help of panoramic indices and their risk of fractures","University of Parma|Queen Mary University of London","Female","65 Years and older   (Older Adult)",,"124","Other","Observational","Observational Model: Case-Control|Time Perspective: Cross-Sectional","P-001","June 12, 2018","January 7, 2021","January 7, 2021","October 9, 2017",,"April 29, 2021","Centro Universitario di Odontoiatria, Parma, Italy",,"https://ClinicalTrials.gov/show/NCT03304743"
305,"NCT01806792","Post-menopausal Women Osteoporosis(Phase III)",,"Completed","No Results Available","Postmenopausal Women Osteoporosis","Drug: risedronate combine|Drug: Risedronate|Drug: Placebo(for Risedronate)|Drug: Placebo(for risedronate combine)","proportion of patients with 25(OH)D level < 20 ng/mL at 16 weeks.|proportion of patients with 25(OH)D level < 9 ng/mL at 16 weeks, change of 25(OH)D level and Bone Markers.","Hanlim Pharm. Co., Ltd.","Female","Child, Adult, Older Adult","Phase 3","150","Industry","Interventional","Allocation: Randomized|Intervention Model: Parallel Assignment|Masking: Double (Participant, Investigator)|Primary Purpose: Treatment","HL_RSNPM_301","November 2009","August 2010","March 2011","March 7, 2013",,"March 7, 2013","Chung-ang university hospital, Seoul, Korea, Republic of",,"https://ClinicalTrials.gov/show/NCT01806792"
306,"NCT03747042","Letrozole in Post-Menopausal Patients With Operable Hormone-Sensitive Breast Cancer",,"Active, not recruiting","No Results Available","Breast Cancer Female","Drug: Letrozole","Measure Ki67 index in highly hormone-dependent breast cancers vs. those that are not","University of Texas Southwestern Medical Center|Cancer Prevention Research Institute of Texas","Female","18 Years and older   (Adult, Older Adult)","Phase 2","61","Other","Interventional","Allocation: N/A|Intervention Model: Single Group Assignment|Masking: None (Open Label)|Primary Purpose: Treatment","SCCC-11118; STU-2018-0015","November 27, 2018","November 30, 2023","November 30, 2024","November 20, 2018",,"June 9, 2022","Simmons Comprehensive Cancer Center at University of Texas Southwestern Medical Center - Dallas, Dallas, Texas, United States",,"https://ClinicalTrials.gov/show/NCT03747042"
307,"NCT02884401","Peri-implant Bone Changes in Post-menopausal Osteoporotic Women",,"Completed","No Results Available","Osteoporosis, Postmenopausal","Device: Dental implant placement (Straumann® Bone Level Tapered, BLT, Roxolid® SLActive®)","Changes in peri-implant horizontal and vertical alveolar bone|changes in implant stability measured with resonance frequency analysis|Implant success","Queen Mary University of London","Female","50 Years and older   (Adult, Older Adult)","Not Applicable","27","Other","Interventional","Allocation: N/A|Intervention Model: Single Group Assignment|Masking: None (Open Label)|Primary Purpose: Treatment","010890","September 2016","March 15, 2022","August 30, 2022","August 31, 2016",,"November 10, 2022","Centre for Oral Clinical Research, Institute of Dentistry, Barts Health, QMUL, London, United Kingdom",,"https://ClinicalTrials.gov/show/NCT02884401"
308,"NCT02184962","Periodontal Disease and Post-menopausal Osteoporosis",,"Completed","No Results Available","Osteoporosis|Osteopenia|Periodontal Disease",,"levels of RANKL and OPG","Universidad Nacional de Córdoba","Female","45 Years to 70 Years   (Adult, Older Adult)",,"81","Other","Observational","Observational Model: Case-Control|Time Perspective: Cross-Sectional","MEV-2030|UNC-2013","May 2012","September 2013","September 2013","July 9, 2014",,"July 9, 2014","Facultad de Odontología - Universidad Nacional de Córdoba, Córdoba, Argentina",,"https://ClinicalTrials.gov/show/NCT02184962"
309,"NCT02945189","Urine Sample Collection From Non Pregnant Peri and Post-menopausal Women",,"Completed","No Results Available","Pregnancy",,"Individual urine samples obtained from 150 not pregnant women aged 41-55 years and 150 not pregnant women aged 56 - 65 years","SPD Development Company Limited|Richmond Pharmacology Limited","Female","41 Years to 65 Years   (Adult, Older Adult)",,"443","Industry","Observational","Observational Model: Case-Only|Time Perspective: Prospective","Protocol-0842","October 2016","March 2017","August 2017","October 26, 2016",,"January 8, 2018",,,"https://ClinicalTrials.gov/show/NCT02945189"
310,"NCT05106010","The Effect of Yoga on Decreasing Risk of Fall-Related Injury in Peri and Post-Menopausal",,"Completed","No Results Available","Fall Injury|Incontinence|Balance; Distorted","Other: Balance Flow Yoga","Muscle Strength Grip Change|Muscle Strength Shoulder and Elbow Change|Muscle Strength Upper Body Change|Balance Change|30 second chair stand change|one leg stand change|modified clinical test of sensory interaction and balance change|balance confidence change|incontinence-ICIQ-UI short form and FLUTS change|incontinence-pad test change|range of motion change|kyphosis change|reaction time|biomechanical outcomes landing on outstretched hand|perceptions of experience","University of Saskatchewan","Female","50 Years to 70 Years   (Adult, Older Adult)",,"36","Other","Observational","Observational Model: Case-Control|Time Perspective: Prospective","Bio 17-64","November 1, 2018","December 15, 2019","February 15, 2020","November 3, 2021",,"November 3, 2021","University of Saskatchewan, Saskatoon, Saskatchewan, Canada",,"https://ClinicalTrials.gov/show/NCT05106010"
311,"NCT03357016","HIIT Versus MICT on Abdominal Fat Mass and Lipid Oxidation in Postmenopausal Women (MATISSE)","MATISSE","Completed","No Results Available","Overweight|Post Menopausal Women","Other: Training programs","Change from baseline abdominal fat mass (g) after 3 months of training (T3-T0/T0 x 100)|Lipids oxidation evaluated by gas exchange measurements|Visceral fat mass|Total fat mass|Fat-free mass|Plasma HbA1c|Glucose level|Plasma triglycerides|Plasma total cholesterol|Plasma HDL-cholesterol|Plasma LDL-cholesterol|Insulin level","Laboratoire des Adaptations Métaboliques à l'Exercice en conditions Physiologiques et Pathologiques|CREPS Vichy Auvergne|University Hospital, Clermont-Ferrand","Female","55 Years to 82 Years   (Adult, Older Adult)","Not Applicable","36","Other","Interventional","Allocation: Randomized|Intervention Model: Parallel Assignment|Masking: Single (Participant)|Primary Purpose: Prevention","AU1303|2016-A01742-49","February 1, 2017","June 8, 2018","June 8, 2018","November 29, 2017",,"August 10, 2018","CREPS Vichy Auvergne, Bellerive-sur-Allier, France",,"https://ClinicalTrials.gov/show/NCT03357016"
312,"NCT05203640","Effects of Resistance Exercise on Blood Glucose in Post-menopausal Women With Type 1 Diabetes",,"Recruiting","No Results Available","Type 1 Diabetes","Behavioral: High repetition (HI)|Behavioral: Moderate repetition (MOD)","Blood glucose|Mean continuous glucose monitoring (CGM) glucose|coefficient of variation (CV)|standard deviation (SD)|frequency of hypoglycemia|frequency of hyperglycemia|percent time in range|percent time in hypoglycemia|percent time in hyperglycemia|carbohydrate supplementation","University of Alberta","Female","45 Years to 75 Years   (Adult, Older Adult)","Not Applicable","15","Other","Interventional","Allocation: N/A|Intervention Model: Single Group Assignment|Masking: None (Open Label)|Primary Purpose: Treatment","Pro00112972","April 1, 2022","December 30, 2022","June 30, 2023","January 24, 2022",,"April 4, 2022","Alberta Diabetes Institute, Edmonton, Alberta, Canada",,"https://ClinicalTrials.gov/show/NCT05203640"
313,"NCT04680325","Impact of Cranberry Juice Consumption on Gut and Vaginal Microbiota in Post-menopausal Women",,"Completed","No Results Available","Urinary Tract Infections","Dietary Supplement: Juice daily consumption","Changes in the vaginal microbiota profile assessed by sequencing of swab samples|Changes in the gut microbiota profile assessed by sequencing of stool samples","University of Arkansas, Fayetteville|Ocean Spray, Inc.","Female","Child, Adult, Older Adult","Not Applicable","23","Other|Industry","Interventional","Allocation: Randomized|Intervention Model: Crossover Assignment|Masking: Double (Participant, Investigator)|Primary Purpose: Basic Science","Ocean Spray","July 1, 2017","November 15, 2017","August 31, 2018","December 22, 2020",,"December 22, 2020","University of Arkansas, Fayetteville, Arkansas, United States",,"https://ClinicalTrials.gov/show/NCT04680325"
314,"NCT05182281","The Effect of Horizontal Whole-body Vibration Therapy in Post-menopausal Women",,"Completed","No Results Available","Osteoporosis|Whole Body Vibration","Device: Whole Body Vibration and Infrared Therapy|Device: Infrared Therapy|Other: Classical Treatment","Body Mass Density|Bone Turnover Markers|The Short Form-36|Visual analog scale|Berg Balance Test","Fatih Sultan Mehmet Training and Research Hospital","Female","45 Years to 65 Years   (Adult, Older Adult)","Not Applicable","60","Other","Interventional","Allocation: Randomized|Intervention Model: Parallel Assignment|Masking: Single (Outcomes Assessor)|Primary Purpose: Treatment","feyzaakan","May 1, 2015","August 1, 2015","August 1, 2015","January 10, 2022",,"January 10, 2022","Feyza Akan BEGOGLU, Istanbul, Turkey",,"https://ClinicalTrials.gov/show/NCT05182281"
