"Rank","NCT Number","Title","Acronym","Status","Study Results","Conditions","Interventions","Outcome Measures","Sponsor/Collaborators","Gender","Age","Phases","Enrollment","Funded Bys","Study Type","Study Designs","Other IDs","Start Date","Primary Completion Date","Completion Date","First Posted","Results First Posted","Last Update Posted","Locations","Study Documents","URL"
1,"NCT00479778","Study Of Pharmacokinetic (PK) Profile of Bazedoxifene (BZA) in 2 BZA/Conjugated Estrogen Forms",,"Completed","No Results Available","Postmenopause","Drug: Bazedoxifene/conjugated estrogens","Pharmacokinetic analyses.","Wyeth is now a wholly owned subsidiary of Pfizer","Female","40 Years to 65 Years   (Adult, Older Adult)","Phase 1","72","Industry","Interventional","Allocation: Randomized|Intervention Model: Parallel Assignment|Masking: None (Open Label)|Primary Purpose: Treatment","3115A1-1121","April 2007",,"July 2007","May 28, 2007",,"December 28, 2007","Gainesville, Florida, United States",,"https://ClinicalTrials.gov/show/NCT00479778"
2,"NCT00195455","Study Evaluating Estradiol/Trimegestone in Vasomotor Symptoms (VMS) in Post-Menopausal Women.",,"Completed","No Results Available","Postmenopause","Drug: Trimegestone|Drug: 17b Estradiol","To assess vasomotor symptoms control with a continuous regimen of 17 b estradiol 1mg and Trimegestone (TMG) 0.125 mg.|Study bleeding patterns throughout the treatment period (6 months)|Evaluate changes in the Menopause-Specific Quality of Life Questionnaire","Wyeth is now a wholly owned subsidiary of Pfizer","Female","45 Years to 55 Years   (Adult)","Phase 4","133","Industry","Interventional","Allocation: Non-Randomized|Intervention Model: Single Group Assignment|Masking: None (Open Label)|Primary Purpose: Treatment","0753T-101538","February 2005",,"March 2007","September 19, 2005",,"December 20, 2007","Guadalajara, Jal., Mexico|Monterrey, N.l., Mexico|Monterrey, N.l., Mexico|Mexico City, Mexico|Mexico City, Mexico|Mexico City, Mexico",,"https://ClinicalTrials.gov/show/NCT00195455"
3,"NCT00185328","Efficacy and Tolerability of Angeliq in Thai Women",,"Completed","No Results Available","Postmenopause","Drug: Estradiol/DRSP (Angeliq, BAY86-4891)","The relative change in the frequency of hot flushes|The change in intensity of hot flushes|The relative change in frequency of hot flushes|The proportions of subjects with urogenital symptoms|Bleeding pattern|Adverse events collection","Bayer","Female","45 Years and older   (Adult, Older Adult)","Phase 4","55","Industry","Interventional","Allocation: Non-Randomized|Intervention Model: Single Group Assignment|Masking: None (Open Label)|Primary Purpose: Treatment","91436|309367","September 2005",,"December 2006","September 16, 2005",,"December 12, 2008",,,"https://ClinicalTrials.gov/show/NCT00185328"
4,"NCT05346445","Comparison of Fluoxetine Versus Citalopram Therapy to Control Postmenopausal Vasomotor Syndrome",,"Completed","No Results Available","Postmenopause|Hot Flashes","Drug: Fluoxetine 20 MG|Drug: Citalopram 20mg","Change from baseline Menopause Rating Scale (MRS) total score at 3 months|Change from baseline Menopause Rating Scale (MRS) total score at 6 months|Change from baseline Menopause Rating Scale (MRS) somatic domain score at 3 months|Change from baseline Menopause Rating Scale (MRS) somatic domain score at 6 months|Change from baseline Menopause Rating Scale (MRS) urogenital domain score at 3 months|Change from baseline Menopause Rating Scale (MRS) urogenital domain score at 6 months|Change from baseline Menopause Rating Scale (MRS) psychological domain score at 3 months|Change from baseline Menopause Rating Scale (MRS) psychological domain score at 6 months|Change from baseline score in Item 1 of the Menopause Rating Scale (MRS) at 3 months|Change from baseline score in Item 1 of the Menopause Rating Scale (MRS) at 6 months|Change from the severity of individual Menopause Rating Scale (MRS) items at 6 months","Hospital Regional 1o de Octubre|Universidad Nacional Autonoma de Mexico|National Polytechnic Institute, Mexico","Female","Child, Adult, Older Adult","Not Applicable","91","Other","Interventional","Allocation: Randomized|Intervention Model: Parallel Assignment|Masking: None (Open Label)|Primary Purpose: Treatment","122.2021","January 20, 2021","November 20, 2021","December 20, 2021","April 26, 2022",,"July 26, 2022","Peri-postmenopause and bone metabolism clinic. Regional Hospital October 1st ISSSTE, Mexico City, Mexico",,"https://ClinicalTrials.gov/show/NCT05346445"
5,"NCT01046149","Effects of Breathing Training on Psychosocial Functioning and Heart Rate Variability in Postmenopausal Women With Depressive Symptoms-2",,"Withdrawn","No Results Available","Postmenopause","Behavioral: Breathing training|Behavioral: Stress management","Depressive symptoms|Heart rate variability (Resting, reactivity to stress, and recovery from stress)","National Science Council, Taiwan","Female","45 Years to 64 Years   (Adult)","Not Applicable","0","Other","Interventional","Allocation: Randomized|Intervention Model: Parallel Assignment|Masking: Triple (Participant, Investigator, Outcomes Assessor)|Primary Purpose: Treatment","NSC98-2629-B-038-002-MY3-TMUH","February 2010",,,"January 11, 2010",,"September 26, 2014","Taipei Medical University Hospital, Taipei, Xinyi Dist., Taiwan",,"https://ClinicalTrials.gov/show/NCT01046149"
6,"NCT01045811","Effects of Breathing Training on Psychosocial Functioning and Heart Rate Variability in Postmenopausal Women With Depressive Symptoms-3",,"Withdrawn","No Results Available","Postmenopause","Behavioral: Breathing training|Behavioral: Stress management","Depressive symptoms|Heart rate variability (Resting, reactivity to stress, and recovery from stress)","National Science Council, Taiwan","Female","45 Years to 64 Years   (Adult)","Not Applicable","0","Other","Interventional","Allocation: Randomized|Intervention Model: Parallel Assignment|Masking: Triple (Participant, Investigator, Outcomes Assessor)|Primary Purpose: Treatment","NSC98-2629-B-038-002-MY3-WFH","May 2010",,,"January 11, 2010",,"September 26, 2014","Taipei Medical University Wangfang Hospital, Taipei, Wenshan Dist., Taiwan",,"https://ClinicalTrials.gov/show/NCT01045811"
7,"NCT01044563","Effects of Breathing Training on Psychosocial Functioning and Heart Rate Variability in Postmenopausal Women With Depressive Symptoms",,"Completed","No Results Available","Postmenopause","Behavioral: Breathing training|Behavioral: Stress management","Depressive symptoms|Heart rate variability (Resting, reactivity to stress, and recovery from stress)","National Science Council, Taiwan","Female","45 Years to 64 Years   (Adult)","Not Applicable","81","Other","Interventional","Allocation: Randomized|Intervention Model: Parallel Assignment|Masking: Triple (Participant, Investigator, Outcomes Assessor)|Primary Purpose: Treatment","NSC98-2629-B-038-002-MY3-TMU","May 2010","August 2010","May 2012","January 8, 2010",,"September 26, 2014","Taipei Medical University, Taipei, Xinyi Dist., Taiwan",,"https://ClinicalTrials.gov/show/NCT01044563"
8,"NCT05401630","Mental Stress Reactivity in Women With CMD",,"Recruiting","No Results Available","Post-menopause","Other: Study Procedures","Planar late Heart to Mediastinal Ratio (MIBG imaging)|Changes in HRV with mental stress|Changes in pre-ejection period (PEP) with mental stress|Changes in flow mediated dilation (FMD test) to acute mental stress in CMD women.|Changes in Peripheral arterial tonometry (PAT) test to acute mental stress in CMD women.|Examine whether chronic stress burden and autonomic dysfunction during daily life is elevated in CMD women.","Emory University|National Heart, Lung, and Blood Institute (NHLBI)","Female","45 Years and older   (Adult, Older Adult)","Not Applicable","150","Other|NIH","Interventional","Allocation: Non-Randomized|Intervention Model: Parallel Assignment|Masking: None (Open Label)|Primary Purpose: Screening","STUDY00003154|1R01HL157311-01A1","July 19, 2022","September 30, 2026","December 31, 2026","June 2, 2022",,"December 8, 2022","Emory Hospital Midtown, Atlanta, Georgia, United States|Emory Saint Joseph's Hospital, Atlanta, Georgia, United States|Emory Clinic, Atlanta, Georgia, United States|Emory Hospital, Atlanta, Georgia, United States",,"https://ClinicalTrials.gov/show/NCT05401630"
9,"NCT05052749","High Intensity Resistance Training In Postmenopausal Women (HIRT)","HIRT","Completed","No Results Available","Post Menopause","Other: High Intensity Resistance Training (HIRT)|Other: Low-moderate Resistance Exercise Training","10RM leg press|10RM dead lift (kg)|Sit and reach test (cm)|Sit and stand test (reps)|Plank test (sec)|6 - minutes' walk test (sec)|Gait speed|Menopause specific Quality of life (MENQOL)","Riphah International University","Female","45 Years to 70 Years   (Adult, Older Adult)","Not Applicable","40","Other","Interventional","Allocation: Randomized|Intervention Model: Parallel Assignment|Masking: Single (Participant)|Primary Purpose: Treatment","REC/00915 Qurat-ul-Ain","March 1, 2021","December 15, 2021","December 31, 2021","September 22, 2021",,"February 2, 2022","Riphah Rehabilitation Center, RCRAHS Westridge campus, Rawalpindi, Punjab, Pakistan",,"https://ClinicalTrials.gov/show/NCT05052749"
10,"NCT00152295","A Long-Term Study to Evaluate the Safety of Asoprisnil and Estrogen Administration to Postmenopausal Women",,"Completed","No Results Available","Postmenopause","Drug: Asoprisnil/Premarin","The percent of subjects in each endometrial biopsy diagnostic category summarized using SPRM Classification System.|The percentage of subjects in each endometrial biopsy diagnostic category summarized using SPRM Classification System|Change from baseline in endometrial thickness (mm) as measured by transvaginal ultrasound.|Frequency and amount of vaginal bleeding assessed via daily diary.|Frequency and severity of hot flushes assessed via daily diary.|Mean change from baseline in endocrine determinations.|Global efficacy question","Abbott","Female","48 Years to 65 Years   (Adult, Older Adult)","Phase 2","18","Industry","Interventional","Allocation: Non-Randomized|Intervention Model: Single Group Assignment|Masking: None (Open Label)|Primary Purpose: Treatment","M01-280","April 2001","December 2001","December 2001","September 9, 2005",,"May 29, 2008",,,"https://ClinicalTrials.gov/show/NCT00152295"
11,"NCT04841499","Effects of a Seven-day BASIS™ Supplementation on Menopausal Syndromes and Measurements of the Urinary Vitamin B3 and Estradiol Levels in Pre-, Peri- and Post-menopause",,"Completed","No Results Available","Menopause","Drug: BASIS™ (Crystalline Nicotinamide Riboside 250mg and Pterostilbene 50mg)","Production of Estradiol|Change undesirable effects of menopause","University of South Alabama|Elysium Health, Inc.","Female","35 Years and older   (Adult, Older Adult)","Not Applicable","40","Other","Interventional","Allocation: N/A|Intervention Model: Single Group Assignment|Masking: None (Open Label)|Primary Purpose: Treatment","USAH-EH301","April 5, 2021","July 15, 2021","July 15, 2021","April 12, 2021",,"November 18, 2021","University of South Alabama, Mobile, Alabama, United States",,"https://ClinicalTrials.gov/show/NCT04841499"
12,"NCT01556737","Effect of Two Different Isoflavone Supplement Preparations on Gene-expression in Postmenopausal Women","ISOII","Completed","No Results Available","Postmenopause","Dietary Supplement: High daidzein supplement|Dietary Supplement: High genistein supplement","Gene-expression in PBMCs|Isoflavone levels in plasma|Gene - expression in adipose tissue|Isoflavone levels in adipose tissue","Wageningen University","Female","50 Years to 70 Years   (Adult, Older Adult)","Not Applicable","72","Other","Interventional","Allocation: Randomized|Intervention Model: Crossover Assignment|Masking: Triple (Participant, Investigator, Outcomes Assessor)","NL37475.081.11|ISO II study","November 2011","September 2012","September 2012","March 16, 2012",,"October 31, 2012","Wageningen University, Wageningen, Gelderland, Netherlands",,"https://ClinicalTrials.gov/show/NCT01556737"
13,"NCT01432028","Pharmacogenetic Study of Different Hormone Therapies in Recent Menopause Women",,"Completed","No Results Available","Postmenopause","Drug: Estradiol and Progesterone|Drug: Estradiol and Drospirenone","Polymorphisms of estrogen receptor|Polymorphisms in the fat mass-and obesity-associated (FTO) gene","Denusa Wiltgen|Hospital de Clinicas de Porto Alegre|Coordenação de Aperfeiçoamento de Pessoal de Nível Superior.|Conselho Nacional de Desenvolvimento Científico e Tecnológico|Federal University of Rio Grande do Sul","Female","42 Years to 58 Years   (Adult)","Not Applicable","90","Other","Interventional","Allocation: Randomized|Intervention Model: Crossover Assignment|Masking: None (Open Label)|Primary Purpose: Treatment","05053","March 2007","April 2011","April 2011","September 12, 2011",,"January 27, 2014","Hospital de Clínicas de Porto Alegre, Porto Alegre, Rio Grande do Sul, Brazil",,"https://ClinicalTrials.gov/show/NCT01432028"
14,"NCT01338142","Amorphous Calcium Carbonate (Acc) Versus Crystalline Calcium Carbonate (Ccc) Using Stable Calcium Isotopes In Postmenopausal Women",,"Unknown status","No Results Available","Postmenopause","Other: CCC|Other: ACC","Mean change in fractional absorption of calcium from amorphous calcium carbonate (ACC) Vs. crystalline calcium carbonate (CCC).","Tel-Aviv Sourasky Medical Center|Amorphical Ltd.","Female","40 Years to 65 Years   (Adult, Older Adult)","Phase 1|Phase 2","15","Other|Industry","Interventional","Allocation: Randomized|Intervention Model: Crossover Assignment|Masking: Double (Participant, Investigator)|Primary Purpose: Treatment","TASMC-10-NV-571-CTIL","May 2011","May 2012","July 2012","April 19, 2011",,"April 19, 2011","Tel Aviv Medical Center, Tel Aviv, Israel",,"https://ClinicalTrials.gov/show/NCT01338142"
15,"NCT01232751","Effects of Isoflavones on Gene-expression","ISO","Completed","No Results Available","Postmenopause","Dietary Supplement: Isoflavone supplement","Gene-expression measured by micro-arrays|Isoflavone levels in plasma and spoturine|Confirmation of gene-expression with quantitative real time polymerase chain reaction (QPCR)","Wageningen University","Female","45 Years to 70 Years   (Adult, Older Adult)","Not Applicable","30","Other","Interventional","Allocation: Randomized|Intervention Model: Crossover Assignment|Masking: Triple (Participant, Investigator, Outcomes Assessor)","NL 32375.081.10","August 2010","October 2011","October 2011","November 2, 2010",,"January 10, 2012","Wageningen University, Wageningen, Gelderland, Netherlands",,"https://ClinicalTrials.gov/show/NCT01232751"
16,"NCT00913926","Effects of Wellnara on Climacteric Symptoms",,"Completed","No Results Available","Postmenopause","Drug: E2/LNG oral (Wellnara, BAY86-5029)","Primary endpoint in the observation of efficacy concerning climacteric complaints is the change in Menopause Rating Scale (MRS II) in relation to the status immediately before starting treatment (Baseline).|Effects on climacteric-related skin, hair, and sexual problems|Subjective assessment of efficacy|Body weight|Blood Pressure|Waist-hip-ratio (as far as routinely used in the practice)|Occurrence of vaginal bleeding|Subjective assessment of tolerability|Adverse drug reactions","Bayer","Female","Child, Adult, Older Adult",,"749","Industry","Observational","Observational Model: Cohort|Time Perspective: Prospective","14575|WN0810DE","September 2007","May 2009","May 2009","June 4, 2009",,"April 22, 2015","Many Locations, Germany",,"https://ClinicalTrials.gov/show/NCT00913926"
17,"NCT00847821","Observational Study Analyzing RNA Expression Of Endometrial Biopsy Samples From Placebo, Bazedoxifene/Conjugated Estrogens And Raloxifene",,"Terminated","No Results Available","Postmenopause","Drug: Bazedoxifene 10 mg/CE 0.625 mg|Drug: Bazedoxifene 20 mg/CE 0.625 mg|Drug: Bazedoxifene 40 mg/CE 0.625 mg|Drug: Bazedoxifene 10 mg/CE 0.45 mg|Drug: Bazedoxifene 20 mg/CE 0.45 mg|Drug: Bazedoxifene 40 mg/CE 0.45 mg|Drug: Raloxifene 60 mg|Drug: Placebo","Endometrial gene regulation at the level of mRNA expression in placebo, Bazedoxifene/CE, and raloxifene treated groups","Wyeth is now a wholly owned subsidiary of Pfizer","Female","40 Years to 75 Years   (Adult, Older Adult)",,"185","Industry","Observational","Observational Model: Cohort|Time Perspective: Retrospective","3115A1-1125|B2311003","May 2009","August 2010","August 2010","February 19, 2009",,"September 6, 2010","Pfizer Investigational Site, Fort Myers, Florida, United States|Pfizer Investigational Site, Gainesville, Florida, United States|Pfizer Investigational Site, New Port Richey, Florida, United States|Pfizer Investigational Site, West Palm Beach, Florida, United States|Pfizer Investigational Site, Decatur, Georgia, United States|Pfizer Investigational Site, Chicago, Illinois, United States|Pfizer Investigational Site, Lexington, Kentucky, United States|Pfizer Investigational Site, Louisville, Kentucky, United States|Pfizer Investigational Site, Southfield, Michigan, United States|Pfizer Investigational Site, Chaska, Minnesota, United States|Pfizer Investigational Site, Billings, Montana, United States|Pfizer Investigational Site, New Brunswick, New Jersey, United States|Pfizer Investigational Site, Las Vegas, New Mexico, United States|Pfizer Investigational Site, Rochester, New York, United States|Pfizer Investigational Site, Raleigh, North Carolina, United States|Pfizer Investigational Site, Cincinnati, Ohio, United States|Pfizer Investigational Site, Wexford, Pennsylvania, United States|Pfizer Investigational Site, Greenville, South Carolina, United States|Pfizer Investigational Site, Dallas, Texas, United States|Pfizer Investigational Site, San Antonio, Texas, United States|Pfizer Investigational Site, Charlottesville, Virginia, United States|Pfizer Investigational Site, Norfolk, Virginia, United States",,"https://ClinicalTrials.gov/show/NCT00847821"
18,"NCT00799708","A Study of the Effect of Estrogen on Estrogen Receptor Biomarkers in Healthy Postmenopausal Women (0000-094)(COMPLETED)",,"Completed","Has Results","Postmenopause","Drug: Comparator: placebo|Drug: Comparator: Estrace","Change From Baseline in Estrogen Receptor Beta (ERbeta) -Specific Gene Signature After Treatment With 2 mg, 0.5 mg, or no Estradiol (Placebo) at Day 7|Change From Baseline in Minor Gland Salivary Flow Rate After Treatment With 2 mg Estradiol vs Placebo at Day 7.","Merck Sharp & Dohme LLC","Female","40 Years and older   (Adult, Older Adult)","Phase 1","27","Industry","Interventional","Allocation: Randomized|Intervention Model: Parallel Assignment|Masking: Double (Participant, Investigator)|Primary Purpose: Diagnostic","0000-094|094|2008_592","May 2008","October 2008","October 2008","December 1, 2008","July 29, 2010","March 16, 2016",,,"https://ClinicalTrials.gov/show/NCT00799708"
19,"NCT00235924","Study Assessing the Effects on Endometrium and Breast of Isoflavone in Post Menopausal Women",,"Unknown status","No Results Available","Postmenopause","Drug: soy isoflavone","- Endometrial innocuity (endometrial biopsy result)|- Mammary innocuity (mammography results)|- climacteric symptoms|-Lipid profile|-gynaecological and general safety","Laboratoires Arkopharma","Female","45 Years to 65 Years   (Adult, Older Adult)","Phase 3","300","Industry","Interventional","Allocation: Non-Randomized|Intervention Model: Single Group Assignment|Masking: None (Open Label)|Primary Purpose: Treatment","PHY04GE01","June 2004",,,"October 12, 2005",,"December 8, 2005",,,"https://ClinicalTrials.gov/show/NCT00235924"
20,"NCT00745173","Study Evaluating Premarin and Bazedoxifene Potential Interaction",,"Completed","No Results Available","Postmenopause","Drug: Premarin","Pharmacokinetic (absorption, distribution, breakdown and elimination in the body) parameters|To continue assessment of the safety profile as well as the tolerability the two drugs administered in combination in this population.","Wyeth is now a wholly owned subsidiary of Pfizer","Female","35 Years to 70 Years   (Adult, Older Adult)","Phase 1","30","Industry","Interventional","Allocation: Non-Randomized|Intervention Model: Crossover Assignment|Masking: None (Open Label)|Primary Purpose: Treatment","3115A1-1135","September 2008","October 2008","October 2008","September 3, 2008",,"February 12, 2009","Dr. David Carter, Austin, Texas, United States",,"https://ClinicalTrials.gov/show/NCT00745173"
21,"NCT00706225","Study Evaluating Potential Drug Interaction Of Bazedoxifene & Premarin In Healthy Postmenopausal Women",,"Completed","No Results Available","Postmenopause","Drug: Bazedoxifene and conjugated estrogens","To evaluate the potential pharmacokinetic (PK) interaction of multiple oral doses of bazedoxifene (BZA) and a single dose of conjugated estrogens (CE) when co administered to healthy postmenopausal women.|To assess the safety of conjugated estrogens (CE) and bazedoxifene (BZA) when co administered to healthy postmenopausal women.","Wyeth is now a wholly owned subsidiary of Pfizer","Female","35 Years to 70 Years   (Adult, Older Adult)","Phase 1","30","Industry","Interventional","Allocation: Non-Randomized|Intervention Model: Crossover Assignment|Masking: None (Open Label)|Primary Purpose: Prevention","3115A1-1134","June 2008","July 2008","July 2008","June 27, 2008",,"September 23, 2010","Daytona Beach, Florida, United States",,"https://ClinicalTrials.gov/show/NCT00706225"
22,"NCT00522873","Endometrial Safety Study",,"Completed","Has Results","Postmenopause","Drug: 0.25mg DRSP / 0.5mg E2 (BAY86-4891)|Drug: 0.5mg NETA / 1.0mg E2 (Activella)","Number of Participants in the DRSP/E2 Group With an Assessment of Endometrial Hyperplasia or Worse at End of Study (EoS) (1 Year of Treatment)|Number of Participants With Amenorrhea During Month 1 to 3 of Treatment|Number of Participants With Amenorrhea During Month 10 to 12 of Treatment","Bayer|Laboratorium für Klinische Forschung|Diagnostic Cytology Laboratory|University of California, San Francisco","Female","40 Years to 65 Years   (Adult, Older Adult)","Phase 3","662","Industry|Other","Interventional","Allocation: Randomized|Intervention Model: Parallel Assignment|Masking: Triple (Participant, Investigator, Outcomes Assessor)|Primary Purpose: Treatment","91508|2006-006199-39|310523","August 2007","August 2009","August 2009","August 30, 2007","June 28, 2012","December 31, 2014","Chandler, Arizona, United States|San Diego, California, United States|San Diego, California, United States|Denver, Colorado, United States|Greenwood Village, Colorado, United States|Boynton Beach, Florida, United States|Clearwater, Florida, United States|Boise, Idaho, United States|Amite, Louisiana, United States|Marrero, Louisiana, United States|Las Vegas, Nevada, United States|Cleveland, Ohio, United States|Philadelphia, Pennsylvania, United States|Columbia, South Carolina, United States|Corpus Christi, Texas, United States|Richmond, Virginia, United States|Seattle, Washington, United States|Lanus Oeste, Buenos Aires, Argentina|San Isidro, Buenos Aires, Argentina|Buenos Aires, Ciudad Auton. de Buenos Aires, Argentina|Buenos Aires, Ciudad Auton. de Buenos Aires, Argentina|Mödling, Niederösterreich, Austria|Wiener Neustadt, Niederösterreich, Austria|Fuerstenfeld, Steiermark, Austria|Wörgl, Tirol, Austria|Bregenz, Vorarlberg, Austria|Innsbruck, Austria|Klagenfurt, Austria|Mürzzuschlag, Austria|St. Poelten, Austria|Wien, Austria|Wien, Austria|Wien, Austria|Wien, Austria|Zeltweg, Austria|Goiania, Goiás, Brazil|Curitiba, Parana, Brazil|Porto Alegre, Rio Grande do Sul, Brazil|Sao Paulo, Brazil|Alborg, Denmark|Ballerup, Denmark|Vejle, Denmark|Bologna, Italy|Cagliari, Italy|Modena, Italy|Novara, Italy|Parma, Italy|Pisa, Italy|Sassari, Italy|Siena, Italy|Mexico, Distrito Federal, Mexico|Mexico, Mexico|Monterrey, Mexico|México, D.F., Mexico|Moscow, Russian Federation|Moscow, Russian Federation|Moskva, Russian Federation|Moskva, Russian Federation|Moskva, Russian Federation",,"https://ClinicalTrials.gov/show/NCT00522873"
23,"NCT00550433","Study Evaluating Bazedoxifene/CE in Postmenopausal Women",,"Completed","No Results Available","Postmenopause","Device: Bazedoxifene/Conjugated Estrogens","The plasma concentration data and pharmacokinetic (PK) parameters of BZA and CE.","Wyeth is now a wholly owned subsidiary of Pfizer","Female","35 Years to 70 Years   (Adult, Older Adult)","Phase 1",,"Industry","Interventional","Allocation: Randomized|Intervention Model: Crossover Assignment|Masking: None (Open Label)|Primary Purpose: Treatment","3115A1-1117","September 2007",,"November 2007","October 29, 2007",,"January 16, 2008",,,"https://ClinicalTrials.gov/show/NCT00550433"
24,"NCT00543634","Study Comparing Premarin®/MPA, PREMPRO® and Provera® in Healthy Postmenopausal Women",,"Completed","No Results Available","Postmenopause","Drug: Premarin/MPA|Drug: Provera 10 mg","Plasma concentration data and pharmacokinetic (PK) parameters of MPA and Premarin® (estrone, equilin and MPA).","Wyeth is now a wholly owned subsidiary of Pfizer|MDS Pharma Services","Female","35 Years to 70 Years   (Adult, Older Adult)","Phase 1","30","Industry","Interventional","Allocation: Randomized|Intervention Model: Crossover Assignment|Masking: None (Open Label)|Primary Purpose: Health Services Research","0713E1-1138","October 2007","December 2007","December 2007","October 15, 2007",,"June 22, 2010","Omaha, Nebraska, United States",,"https://ClinicalTrials.gov/show/NCT00543634"
